{
  "schema_version": 1,
  "project_root": "examples/rtl/counter",
  "target": "fpga",
  "source_kinds": ["handwritten"],
  "top": "counter",
  "source_roots": ["examples/rtl/counter/rtl"],
  "sources": ["examples/rtl/counter/rtl/counter.sv"],
  "headers": [],
  "include_dirs": ["examples/rtl/counter/rtl"],
  "defines": {},
  "parameters": {},
  "clocks": ["clk_i"],
  "resets": ["rst_ni"]
}
